{
  "id": "dark-mode",
  "name": "Dark Mode",
  "nameZh": "深色模式",
  "category": "theme",
  "description": "Dark background with reduced brightness and focused content",
  "descriptionZh": "深色背景，降低亮度，聚焦内容本身",
  "author": "core",
  "references": ["https://m3.material.io/styles/color/dark-theme"],
  "variables": {
    "--color-primary": "#a855f7",
    "--color-primary-hover": "#c084fc",
    "--color-bg": "#09090b",
    "--color-surface": "#18181b",
    "--color-text": "#fafafa",
    "--color-text-secondary": "#a1a1aa",
    "--color-accent": "#2dd4bf",
    "--color-border": "#27272a",
    "--border-radius": "16px",
    "--border-width": "1px",
    "--border-color": "#27272a",
    "--shadow-x": "0px",
    "--shadow-y": "8px",
    "--shadow-blur": "24px",
    "--shadow-spread": "0px",
    "--shadow-color": "rgba(0, 0, 0, 0.5)",
    "--font-family": "'Inter', 'Noto Sans SC', sans-serif",
    "--font-weight": "400",
    "--font-weight-bold": "600",
    "--backdrop-blur": "0px",
    "--bg-opacity": "1"
  },
  "specialTuning": [],
  "keyProperties": [
    { "property": "background: #121212", "explanation": "纯黑偏灰的基底，减少视觉疲劳" },
    { "property": "color: #e0e0e0", "explanation": "柔和白而非纯白，降低对比刺激" },
    { "property": "border: rgba(255,255,255,0.08)", "explanation": "极低不透明度边框提供微弱分隔" }
  ]
}
