{
  "id": "retro",
  "name": "Retro / Pixel",
  "nameZh": "像素复古",
  "category": "theme",
  "description": "Pixel art aesthetic with neon accents and retro typography",
  "descriptionZh": "像素风、霓虹色、等宽字体，怀旧数字感",
  "author": "core",
  "references": [],
  "variables": {
    "--color-primary": "#ff0080",
    "--color-primary-hover": "#cc0066",
    "--color-bg": "#0a0a1a",
    "--color-surface": "#12122b",
    "--color-text": "#00f0ff",
    "--color-text-secondary": "#a0a0c0",
    "--color-accent": "#fcee0a",
    "--color-border": "#ff0080",
    "--border-radius": "0px",
    "--border-width": "2px",
    "--border-color": "#ff0080",
    "--shadow-x": "0px",
    "--shadow-y": "0px",
    "--shadow-blur": "16px",
    "--shadow-spread": "0px",
    "--shadow-color": "rgba(255, 0, 128, 0.5)",
    "--font-family": "'Press Start 2P', 'ZCOOL QingKe HuangYou', 'Courier Prime', monospace",
    "--font-weight": "400",
    "--font-weight-bold": "400",
    "--backdrop-blur": "0px",
    "--bg-opacity": "1",
    "--glow-intensity": "1",
    "--glow-color": "#ff0080"
  },
  "specialTuning": [
    {
      "variable": "--glow-color",
      "label": "Neon Color",
      "labelZh": "霓虹颜色",
      "type": "color"
    },
    {
      "variable": "--shadow-blur",
      "label": "Glow Intensity",
      "labelZh": "发光强度",
      "type": "range",
      "min": 0,
      "max": 30,
      "step": 1,
      "unit": "px"
    }
  ],
  "keyProperties": [
    { "property": "font-family: pixel", "explanation": "像素字体是复古风的核心标识" },
    { "property": "text-shadow: neon glow", "explanation": "霓虹发光效果营造 CRT 屏幕感" },
    { "property": "color: #00ff88", "explanation": "绿色终端色致敬早期计算机" }
  ]
}
