{
  "id": "flat",
  "name": "Flat Design",
  "nameZh": "扁平设计",
  "category": "classic",
  "description": "Clean, minimal, no shadows, bold solid colors",
  "descriptionZh": "极简纯粹，大面积纯色，零阴影零渐变",
  "author": "core",
  "references": ["https://en.wikipedia.org/wiki/Flat_design"],
  "variables": {
    "--color-primary": "#2563eb",
    "--color-primary-hover": "#1d4ed8",
    "--color-bg": "#f8fafc",
    "--color-surface": "#ffffff",
    "--color-text": "#0f172a",
    "--color-text-secondary": "#64748b",
    "--color-accent": "#ef4444",
    "--color-border": "#e2e8f0",
    "--border-radius": "8px",
    "--border-width": "2px",
    "--border-color": "#e2e8f0",
    "--shadow-x": "0px",
    "--shadow-y": "0px",
    "--shadow-blur": "0px",
    "--shadow-spread": "0px",
    "--shadow-color": "transparent",
    "--font-family": "'Inter', 'Noto Sans SC', sans-serif",
    "--font-weight": "400",
    "--font-weight-bold": "700",
    "--backdrop-blur": "0px",
    "--bg-opacity": "1"
  },
  "specialTuning": [],
  "keyProperties": [
    { "property": "box-shadow: none", "explanation": "扁平设计的核心：完全没有阴影" },
    { "property": "border-radius: 0", "explanation": "直角边缘强化几何感" },
    { "property": "background: solid color", "explanation": "大面积纯色块，无渐变" }
  ]
}
